{
  "id": 4,
  "name": "businessDateCheck",
  "description": "Business date validation for fraud prevention",
  "content": "rule businessDateCheck:\n    if applicant.applicationDate after business_date then conditionalApproval\n    if applicant.applicationDate before business_date then rejectApplication",
  "status": "DRAFT",
  "item_type": "rule",
  "effective_date": null,
  "expiry_date": null,
  "version": 1,
  "schema_version": "modern",
  "java_file_path": null,
  "validation_message": null,
  "context_id": null,
  "created_at": "2025-10-05T01:55:57.578085",
  "updated_at": "2025-10-13T22:10:40.154739",
  "created_by": "system",
  "updated_by": "system"
}