{
  "id": 28,
  "name": "International Transaction Processing",
  "description": "Process international purchases with foreign exchange fees",
  "content": "rule \"International Transaction Processing\":\n    if transaction.location.country != \"US\" and transaction.amount <= account.internationalLimit then\n        approveTransaction(transaction.amount),\n        applyForeignExchangeFee(transaction.amount * 0.025),\n        updateAccountBalance(transaction.amount + transaction.amount * 0.025)\n    else if transaction.location.country != \"US\" and transaction.amount > account.internationalLimit then\n        declineTransaction(\"International transaction limit exceeded\")\n    else\n        approveTransaction(transaction.amount)",
  "status": "DRAFT",
  "item_type": "mon_rule",
  "effective_date": null,
  "expiry_date": null,
  "version": 1,
  "schema_version": "modern",
  "java_file_path": null,
  "validation_message": null,
  "context_id": null,
  "created_at": "2025-10-13T23:41:09.223471",
  "updated_at": "2025-10-13T23:41:09.223471",
  "created_by": "system",
  "updated_by": "system",
  "hierarchy": {
    "client_id": 2,
    "client_code": "PREMIUM",
    "client_name": "Premium Card Co",
    "process_group_id": 4,
    "process_group_code": "REWARDS",
    "process_group_name": "Rewards Cards",
    "process_area_id": 6,
    "process_area_code": "REWARDS_APPROVAL",
    "process_area_name": "Rewards Approval"
  }
}