{
  "id": 10,
  "name": "employmentYearsCheck",
  "description": "Employment stability for credit limit determination",
  "content": "rule employmentYearsCheck:\n    if applicant.employmentYears >= 2 then approveApplication\n    if applicant.employmentYears < 1 then rejectApplication\n    if applicant.employmentYears >= 1 and applicant.employmentYears < 2 then conditionalApproval",
  "status": "VALID",
  "item_type": "rule",
  "effective_date": null,
  "expiry_date": null,
  "version": 1,
  "schema_version": "modern",
  "java_file_path": null,
  "validation_message": null,
  "context_id": null,
  "created_at": "2025-10-13T23:41:09.221313",
  "updated_at": "2025-10-13T23:41:09.221313",
  "created_by": "system",
  "updated_by": "system",
  "hierarchy": {
    "client_id": 1,
    "client_code": "DEMO",
    "client_name": "Demo Bank",
    "process_group_id": 2,
    "process_group_code": "CC_PREM",
    "process_group_name": "Premium Cards",
    "process_area_id": 4,
    "process_area_code": "CREDIT_LIMITS",
    "process_area_name": "Credit Limits"
  }
}