{
  "id": 3,
  "name": "incomeVerification",
  "description": "Annual income threshold for standard cards",
  "content": "rule incomeVerification:\n    if applicant.annualIncome >= 50000 then approveApplication\n    if applicant.annualIncome < 25000 then rejectApplication\n    if applicant.annualIncome >= 25000 and applicant.annualIncome < 50000 then conditionalApproval",
  "status": "VALID",
  "item_type": "rule",
  "effective_date": null,
  "expiry_date": null,
  "version": 1,
  "schema_version": "modern",
  "java_file_path": null,
  "validation_message": null,
  "context_id": null,
  "created_at": "2025-10-05T01:55:57.578084",
  "updated_at": "2025-10-13T22:10:40.153501",
  "created_by": "system",
  "updated_by": "system"
}