{
  "id": 26,
  "name": "Cash Advance Processing",
  "description": "Process cash advance requests with fees",
  "content": "rule \"Cash Advance Processing\":\n    if transaction.type == \"CASH_ADVANCE\" and transaction.amount <= account.cashAdvanceLimit then\n        approveCashAdvance(transaction.amount),\n        applyFee(transaction.amount * 0.03),\n        updateAccountBalance(transaction.amount + transaction.amount * 0.03)\n    else\n        declineTransaction(\"Cash advance limit exceeded\")",
  "status": "VALID",
  "item_type": "mon_rule",
  "effective_date": null,
  "expiry_date": null,
  "version": 2,
  "schema_version": "modern",
  "java_file_path": null,
  "validation_message": null,
  "context_id": "Premium High Value Context",
  "created_at": "2025-10-05T01:55:57.579787",
  "updated_at": "2025-10-14T18:42:59.982943",
  "created_by": "system",
  "updated_by": "system"
}