{
  "id": 22,
  "name": "Credit Limit Increase Request",
  "description": "Process credit limit increase requests",
  "content": "rule \"Credit Limit Increase Request\":\n    if account.creditScore > 750 and account.requestedLimit <= account.income * 0.3 then\n        setCreditLimit(account.requestedLimit),\n        logCreditChange(\"Automatic approval\")\n    else\n        requireManualReview(\"High limit request\")",
  "status": "VALID",
  "item_type": "non_mon_rule",
  "effective_date": null,
  "expiry_date": null,
  "version": 1,
  "schema_version": "modern",
  "java_file_path": null,
  "validation_message": null,
  "context_id": null,
  "created_at": "2025-10-05T01:55:57.579785",
  "updated_at": "2025-10-13T22:10:40.175262",
  "created_by": "system",
  "updated_by": "system"
}