{
  "id": 19,
  "name": "Platinum Tier Qualification",
  "description": "Comprehensive qualification process for platinum cards",
  "content": "rule \"Platinum Tier Qualification\":\n    if applicant.annualIncome >= 200000 and applicant.creditScore >= 780 then\n        platinumApproval, \"assign concierge services\", setupPlatinumBenefits\n    if applicant.annualIncome >= 150000 and applicant.creditScore >= 750 then\n        conditionalPlatinum, requestFinancialVerification\n    else rejectPlatinum, \"suggest premium alternative\"",
  "status": "PROD",
  "item_type": "actionset",
  "effective_date": null,
  "expiry_date": null,
  "version": 1,
  "schema_version": "modern",
  "java_file_path": null,
  "validation_message": null,
  "context_id": null,
  "created_at": "2025-10-13T23:41:09.221919",
  "updated_at": "2025-10-13T23:41:09.221920",
  "created_by": "system",
  "updated_by": "system",
  "hierarchy": {
    "client_id": 2,
    "client_code": "PREMIUM",
    "client_name": "Premium Card Co",
    "process_group_id": 3,
    "process_group_code": "PLATINUM",
    "process_group_name": "Platinum Cards",
    "process_area_id": 5,
    "process_area_code": "PLATINUM_ELIGIBILITY",
    "process_area_name": "Platinum Eligibility"
  }
}