{
  "id": 18,
  "name": "High Net Worth Processing",
  "description": "Expedited processing for high-value clients",
  "content": "rule highNetWorthProcessing:\n    if applicant.annualIncome >= 250000 then fastTrackApproval, assignPrivateBanker\n    if applicant.creditScore >= 800 and applicant.employmentYears >= 5 then premiumApproval\n    else conditionalApproval, schedulePersonalConsultation",
  "status": "VALID",
  "item_type": "actionset",
  "effective_date": null,
  "expiry_date": null,
  "version": 1,
  "schema_version": "modern",
  "java_file_path": null,
  "validation_message": null,
  "context_id": null,
  "created_at": "2025-10-05T01:55:57.578574",
  "updated_at": "2025-10-13T22:10:40.170933",
  "created_by": "system",
  "updated_by": "system"
}