{
  "id": 10,
  "name": "employmentYearsCheck",
  "description": "Employment stability check for credit limit determination",
  "content": "rule employmentYearsCheck:\n    if applicant.employmentYears >= 2 then approveApplication\n    if applicant.employmentYears < 1 then rejectApplication\n    if applicant.employmentYears >= 1 and applicant.employmentYears < 2 then conditionalApproval",
  "status": "VALID",
  "item_type": "rule",
  "effective_date": null,
  "expiry_date": null,
  "version": 2,
  "schema_version": "modern",
  "java_file_path": null,
  "validation_message": null,
  "context_id": null,
  "created_at": "2025-10-05T01:55:57.578089",
  "updated_at": "2025-10-21T01:35:30.403722",
  "created_by": "system",
  "updated_by": "system"
}