{
  "id": 28,
  "name": "International Transaction Processing",
  "description": "Process international purchases with foreign exchange fees",
  "content": "rule \"International Transaction Processing\":\n    if transaction.location.country != 'US' and transaction.amount <= account.internationalLimit then\n        approveTransaction(transaction.amount),\n        applyForeignExchangeFee(transaction.amount * 0.025),\n        updateAccountBalance(transaction.amount + transaction.amount * 0.025)\n    elseif transaction.location.country != 'US' and transaction.amount > account.internationalLimit then\n        declineTransaction(\"International transaction limit exceeded\")\n    else\n        approveTransaction(transaction.amount)\n    endif\n    if applicant.creditScore > 720\n    then\n        approveTransaction\n    endif",
  "status": "VALID",
  "item_type": "rule",
  "effective_date": null,
  "expiry_date": null,
  "version": 9,
  "schema_version": "modern",
  "java_file_path": null,
  "validation_message": "No content changes",
  "context_id": "Premium High Value Context",
  "created_at": "2025-10-05T01:55:57.579788",
  "updated_at": "2025-10-21T00:47:27.351942",
  "created_by": "system",
  "updated_by": "demo-user"
}