{
  "id": 26,
  "name": "Cash Advance Processing",
  "description": "Process cash advance requests with fees",
  "content": "rule \"Cash Advance Processing\":\n    if transaction.type == \"CASH_ADVANCE\" and transaction.amount <= account.cashAdvanceLimit then\n        approveCashAdvance(transaction.amount),\n        applyFee(transaction.amount * 0.03),\n        updateAccountBalance(transaction.amount + transaction.amount * 0.03)\n    else\n        declineTransaction(\"Cash advance limit exceeded\")",
  "status": "VALID",
  "item_type": "mon_rule",
  "effective_date": null,
  "expiry_date": null,
  "version": 1,
  "schema_version": "modern",
  "java_file_path": null,
  "validation_message": null,
  "context_id": null,
  "created_at": "2025-10-13T23:41:09.223470",
  "updated_at": "2025-10-13T23:41:09.223470",
  "created_by": "system",
  "updated_by": "system",
  "hierarchy": {
    "client_id": 1,
    "client_code": "DEMO",
    "client_name": "Demo Bank",
    "process_group_id": 2,
    "process_group_code": "CC_PREM",
    "process_group_name": "Premium Cards",
    "process_area_id": 4,
    "process_area_code": "CREDIT_LIMITS",
    "process_area_name": "Credit Limits"
  }
}