{
  "id": 31,
  "name": "sendEmail",
  "description": "Send email notification to applicant or customer",
  "content": "com/rules/actions/EmailAction.java",
  "status": "VALID",
  "item_type": "action",
  "effective_date": null,
  "expiry_date": null,
  "version": 1,
  "schema_version": "modern",
  "java_file_path": null,
  "validation_message": null,
  "context_id": null,
  "created_at": "2025-10-05T01:55:57.582453",
  "updated_at": "2025-10-13T22:10:40.184524",
  "created_by": "system",
  "updated_by": "system"
}