{
  "id": 33,
  "name": "approve1",
  "description": "test",
  "content": "com/rules/RuleExecutor.java",
  "status": "deleted",
  "item_type": "action",
  "effective_date": null,
  "expiry_date": null,
  "version": 1,
  "schema_version": "modern",
  "java_file_path": null,
  "validation_message": "Action created successfully",
  "context_id": null,
  "created_at": "2025-10-05T02:46:25.057649",
  "updated_at": "2025-10-13T22:10:40.186573",
  "created_by": "system",
  "updated_by": "system"
}