{
  "id": 29,
  "name": "approve",
  "description": "Approve a credit card application or transaction",
  "content": "com/rules/actions/ApprovalAction.java",
  "status": "VALID",
  "item_type": "action",
  "effective_date": null,
  "expiry_date": null,
  "version": 1,
  "schema_version": "modern",
  "java_file_path": null,
  "validation_message": null,
  "context_id": null,
  "created_at": "2025-10-05T01:55:57.582451",
  "updated_at": "2025-10-13T22:10:40.181841",
  "created_by": "system",
  "updated_by": "system"
}