{
  "id": 27,
  "name": "Monthly Fee Application",
  "description": "Apply monthly maintenance fees based on account tier",
  "content": "rule \"Monthly Fee Application\":\n    if account.tier == \"PREMIUM\" and account.monthlySpend < 1000 then\n        applyMonthlyFee(25.00),\n        notifyCustomer(\"Monthly maintenance fee applied\")\n    else if account.tier == \"STANDARD\" and account.balance < 500 then\n        applyMonthlyFee(10.00),\n        notifyCustomer(\"Low balance fee applied\")\n    else\n        waiveFee(\"Spending threshold met\")",
  "status": "VALID",
  "item_type": "mon_rule",
  "effective_date": null,
  "expiry_date": null,
  "version": 1,
  "schema_version": "modern",
  "java_file_path": null,
  "validation_message": null,
  "context_id": null,
  "created_at": "2025-10-13T23:41:09.223470",
  "updated_at": "2025-10-13T23:41:09.223470",
  "created_by": "system",
  "updated_by": "system",
  "hierarchy": {
    "client_id": 2,
    "client_code": "PREMIUM",
    "client_name": "Premium Card Co",
    "process_group_id": 3,
    "process_group_code": "PLATINUM",
    "process_group_name": "Platinum Cards",
    "process_area_id": 5,
    "process_area_code": "PLATINUM_ELIGIBILITY",
    "process_area_name": "Platinum Eligibility"
  }
}