{
  "id": 21,
  "name": "Address Update Validation",
  "description": "Validate customer address change requests",
  "content": "rule \"Address Update Validation\":\n    if applicant.addressChangeRequest == true and applicant.documentationProvided == true then\n        updateCustomerAddress(applicant.newAddress),\n        notifyCustomer(\"Address updated successfully\")\n    else\n        requestAdditionalDocumentation",
  "status": "VALID",
  "item_type": "non_mon_rule",
  "effective_date": null,
  "expiry_date": null,
  "version": 1,
  "schema_version": "modern",
  "java_file_path": null,
  "validation_message": null,
  "context_id": null,
  "created_at": "2025-10-13T23:41:09.223465",
  "updated_at": "2025-10-13T23:41:09.223466",
  "created_by": "system",
  "updated_by": "system",
  "hierarchy": {
    "client_id": 1,
    "client_code": "DEMO",
    "client_name": "Demo Bank",
    "process_group_id": 1,
    "process_group_code": "CC_STD",
    "process_group_name": "Standard Cards",
    "process_area_id": 1,
    "process_area_code": "APPROVAL",
    "process_area_name": "Application Approval"
  }
}