{
  "id": 7,
  "name": "premiumEligibilityCheck",
  "description": "Premium card eligibility requirements",
  "content": "rule premiumEligibilityCheck:\n    if applicant.creditScore >= 750 and applicant.annualIncome >= 80000 and applicant.employmentYears >= 5 then premiumApproval\n    if applicant.creditScore >= 720 and applicant.annualIncome >= 60000 then approveApplication\n    if applicant.creditScore < 700 then rejectApplication",
  "status": "VALID",
  "item_type": "rule",
  "effective_date": null,
  "expiry_date": null,
  "version": 1,
  "schema_version": "modern",
  "java_file_path": null,
  "validation_message": null,
  "context_id": null,
  "created_at": "2025-10-05T01:55:57.578087",
  "updated_at": "2025-10-13T22:10:40.158019",
  "created_by": "system",
  "updated_by": "system"
}