{
  "id": 13,
  "name": "rewardsPointsRule",
  "description": "Points-based rewards card approval for high spenders",
  "content": "rule rewardsPointsRule:\n    if applicant.creditScore >= 700 and applicant.annualIncome >= 60000 then approveApplication\n    if applicant.employmentStatus == \"employed\" and applicant.employmentYears >= 3 then approveApplication\n    if applicant.creditScore < 680 then rejectApplication",
  "status": "VALID",
  "item_type": "rule",
  "effective_date": null,
  "expiry_date": null,
  "version": 1,
  "schema_version": "modern",
  "java_file_path": null,
  "validation_message": null,
  "context_id": null,
  "created_at": "2025-10-13T23:41:09.221315",
  "updated_at": "2025-10-13T23:41:09.221315",
  "created_by": "system",
  "updated_by": "system",
  "hierarchy": {
    "client_id": 2,
    "client_code": "PREMIUM",
    "client_name": "Premium Card Co",
    "process_group_id": 4,
    "process_group_code": "REWARDS",
    "process_group_name": "Rewards Cards",
    "process_area_id": 6,
    "process_area_code": "REWARDS_APPROVAL",
    "process_area_name": "Rewards Approval"
  }
}