{
  "id": 16,
  "name": "Risk Evaluation Suite",
  "description": "Comprehensive risk assessment for fraud prevention",
  "content": "rule riskEvaluation:\n    calculateRiskScore\n    if applicant.bankruptcyHistory == true then rejectApplication, logHighRiskApplicant\n    if applicant.employmentYears < 1 and applicant.age < 25 then requireCoSigner, scheduleManualReview\n    if applicant.monthlyIncome >= 5000 and applicant.creditScore >= 700 then approveApplication\n    else conditionalApproval",
  "status": "VALID",
  "item_type": "actionset",
  "effective_date": null,
  "expiry_date": null,
  "version": 1,
  "schema_version": "modern",
  "java_file_path": null,
  "validation_message": null,
  "context_id": null,
  "created_at": "2025-10-05T01:55:57.578573",
  "updated_at": "2025-10-13T22:10:40.168499",
  "created_by": "system",
  "updated_by": "system"
}