{
  "id": 14,
  "name": "Standard Application Workflow",
  "description": "Complete workflow for standard credit card applications",
  "content": "rule \"Standard Application Workflow\":\n    validateApplicantInfo\n    if applicant.creditScore >= 700 then approveApplication, sendWelcomeEmail\n    if applicant.creditScore < 600 then rejectApplication, sendRejectionLetter\n    else conditionalApproval, requestDocumentation\n    updateCustomerRecord",
  "status": "VALID",
  "item_type": "actionset",
  "effective_date": null,
  "expiry_date": null,
  "version": 1,
  "schema_version": "modern",
  "java_file_path": null,
  "validation_message": null,
  "context_id": null,
  "created_at": "2025-10-05T01:55:57.578571",
  "updated_at": "2025-10-13T22:10:40.166546",
  "created_by": "system",
  "updated_by": "system"
}