{
  "id": 9,
  "name": "highValueApplicant",
  "description": "High credit limit for qualified applicants",
  "content": "rule highValueApplicant:\n    if applicant.creditScore >= 800 and applicant.annualIncome >= 100000 then fastTrackApproval\n    if applicant.creditScore >= 750 and applicant.annualIncome >= 75000 then approveApplication",
  "status": "VALID",
  "item_type": "rule",
  "effective_date": null,
  "expiry_date": null,
  "version": 1,
  "schema_version": "modern",
  "java_file_path": null,
  "validation_message": null,
  "context_id": null,
  "created_at": "2025-10-05T01:55:57.578088",
  "updated_at": "2025-10-13T22:10:40.160203",
  "created_by": "system",
  "updated_by": "system"
}