{
  "id": 32,
  "name": "testAction",
  "description": "Test action for validation",
  "content": "com/rules/actions/TestAction.java",
  "status": "deleted",
  "item_type": "action",
  "effective_date": null,
  "expiry_date": null,
  "version": 1,
  "schema_version": "modern",
  "java_file_path": null,
  "validation_message": "Action created successfully",
  "context_id": null,
  "created_at": "2025-10-05T02:44:46.582887",
  "updated_at": "2025-10-13T22:10:40.185583",
  "created_by": "system",
  "updated_by": "system"
}